id,abbr,name,publisher,url,rank,type,category
606,AMIA,American Medical Informatics Association Annual Symposium,AMIA,http://dblp.uni-trier.de/db/conf/amia/,C,Conference,交叉
607,APBC,Asia Pacific Bioinformatics Conference,BioMed Central,http://dblp.uni-trier.de/db/conf/apbc/,C,Conference,交叉
608,IICOBD,IEEE International Conference on Big Data,IEEE,https://dblp.uni-trier.de/db/conf/bigdataconf/,C,Conference,交叉
609,IICOCC,IEEE International Conference on Cloud Computing,IEEE,http://dblp.uni-trier.de/db/conf/IEEEcloud/,C,Conference,交叉
610,SMC,"IEEE International Conference on Systems, Man, and Cybernetics",IEEE,https://dblp.uni-trier.de/db/conf/smc/,C,Conference,交叉
611,COSIT,International Conference on Spatial Information Theory,ACM,http://dblp.uni-trier.de/db/conf/cosit/,C,Conference,交叉
612,ISBRA,International Symposium on Bioinformatics Research and Applications,Springer,https://dblp.uni-trier.de/db/conf/isbra/,C,Conference,交叉
