id,abbr,name,publisher,url,rank,type,category
200,ESE,Empirical Software Engineering,Springer,http://dblp.uni-trier.de/db/journals/ese/,B,Journal,软工
201,TSC,IEEE Transactions on Service Computing,IEEE,http://dblp.uni-trier.de/db/journals/tsc/,B,Journal,软工
202,IETS,IET Software,IET,http://dblp.uni-trier.de/db/journals/iee/index.html、https://dblp.uni-trier.de/db/journals/iet-sen/index.html,B,Journal,软工
203,IST,Information and Software Technology,Elsevier,http://dblp.uni-trier.de/db/journals/infsof/index.html,B,Journal,软工
204,JFP,Journal of Functional Programming,Cambridge University Press,http://dblp.uni-trier.de/db/journals/jfp/,B,Journal,软工
205,JOSEAP,Journal of Software: Evolution and Process,Wiley,http://dblp.uni-trier.de/db/journals/smr/,B,Journal,软工
206,JSS,Journal of Systems and Software,Elsevier,http://dblp.uni-trier.de/db/journals/jss/,B,Journal,软工
207,RE,Requirements Engineering,Springer,http://dblp.uni-trier.de/db/journals/re/,B,Journal,软工
208,SCP,Science of Computer Programming,Elsevier,http://dblp.uni-trier.de/db/journals/scp/,B,Journal,软工
209,SoSyM,Software and System Modeling,Springer,http://dblp.uni-trier.de/db/journals/sosym/,B,Journal,软工
210,STVR,"Software Testing, Verification and Reliability",Wiley,http://dblp.uni-trier.de/db/journals/stvr/index.html,B,Journal,软工
211,SPE,Software: Practice and Experience,Wiley,http://dblp.uni-trier.de/db/journals/spe/,B,Journal,软工
212,CL,"Computer Languages, Systems and Structures",Elsevier,http://dblp.uni-trier.de/db/journals/cl/index.html,C,Journal,软工
213,IJSEKE,International Journal on Software Engineering and Knowledge Engineering,World Scientific,http://dblp.uni-trier.de/db/journals/ijseke/index.html,C,Journal,软工
214,STTT,International Journal on Software Tools for Technology Transfer,Springer,http://dblp.uni-trier.de/db/journals/sttt/,C,Journal,软工
215,JLAP,Journal of Logic and Algebraic Programming,Elsevier,http://dblp.uni-trier.de/db/journals/jlp/jlap.html,C,Journal,软工
216,JWE,Journal of Web Engineering,Rinton Press,http://dblp.uni-trier.de/db/journals/jwe/,C,Journal,软工
217,SOCA,Service Oriented Computing and Applications,Springer,http://dblp.uni-trier.de/db/journals/soca/,C,Journal,软工
218,SQJ,Software Quality Journal,Springer,http://dblp.uni-trier.de/db/journals/sqj/,C,Journal,软工
219,TPLP,Theory and Practice of Logic Programming,Cambridge University Press,http://dblp.uni-trier.de/db/journals/tplp/,C,Journal,软工
220,PLDI,ACM SIGPLAN Symposium on Programming Language Design & Implementation,ACM,http://dblp.uni-trier.de/db/conf/pldi/,A,Conference,软工
221,POPL,ACM SIGPLAN-SIGACT Symposium on Principles of Programming Languages,ACM,http://dblp.uni-trier.de/db/conf/popl/,A,Conference,软工
222,FSE-ESEC,ACM SIGSOFT Symposium on the Foundation of Software Engineering/ European Software Engineering Conference,ACM,http://dblp.uni-trier.de/db/conf/sigsoft/,A,Conference,软工
223,SOSP,ACM Symposium on Operating Systems Principles,ACM,http://dblp.uni-trier.de/db/conf/sosp/,A,Conference,软工
224,OOPSLA,"Conference on Object-Oriented Programming Systems, Languages,and Applications",ACM,http://dblp.uni-trier.de/db/conf/oopsla/,A,Conference,软工
225,ASE,International Conference on Automated Software Engineering,IEEE/ACM,http://dblp.uni-trier.de/db/conf/kbse/,A,Conference,软工
226,ICSE,International Conference on Software Engineering,ACM/IEEE,http://dblp.uni-trier.de/db/conf/icse/,A,Conference,软工
227,ISSTA,International Symposium on Software Testing and Analysis,ACM,http://dblp.uni-trier.de/db/conf/issta/,A,Conference,软工
228,OSDI,USENIX Symposium on Operating Systems Design and Implementations,USENIX,http://dblp.uni-trier.de/db/conf/osdi/,A,Conference,软工
229,ECOOP,European Conference on Object-Oriented Programming,AITO,http://dblp.uni-trier.de/db/conf/ecoop/,B,Conference,软工
230,ETAPS,European Joint Conferences on Theory and Practice of Software,Springer,http://dblp.uni-trier.de/db/conf/etaps/,B,Conference,软工
231,ICPC,IEEE International Conference on Program Comprehension,IEEE,http://dblp.uni-trier.de/db/conf/iwpc/,B,Conference,软工
232,RE,IEEE International Requirement Engineering Conference,IEEE,http://dblp.uni-trier.de/db/conf/re/,B,Conference,软工
233,CAiSE,International Conference on Advanced Information Systems Engineering,Springer,http://dblp.uni-trier.de/db/conf/caise/,B,Conference,软工
234,ICFP,International Conference on Function Programming,ACM,http://dblp.uni-trier.de/db/conf/icfp/,B,Conference,软工
235,LCTES,"International Conference on Languages,Compilers, Tools and Theory for Embedded Systems",ACM,http://dblp.uni-trier.de/db/conf/lctrts/,B,Conference,软工
236,MoDELS,International Conference on Model Driven Engineering Languages and Systems,"ACM, IEEE",http://dblp.uni-trier.de/db/conf/models/,B,Conference,软工
237,CP,International Conference on Principles and Practice of Constraint Programming,Springer,http://dblp.uni-trier.de/db/conf/cp/,B,Conference,软工
238,ICSOC,International Conference on Service Oriented Computing,Springer,http://dblp.uni-trier.de/db/conf/icsoc/,B,Conference,软工
239,SANER,"International Conference on Software Analysis, Evolution, and Reengineering",IEEE,http://dblp.uni-trier.de/db/conf/wcre/,B,Conference,软工
240,ICSME,International Conference on Software Maintenance and Evolution,IEEE,http://dblp.uni-trier.de/db/conf/icsm/,B,Conference,软工
241,VMCAI,"International Conference on Verification,Model Checking, and Abstract Interpretation",Springer,http://dblp.uni-trier.de/db/conf/vmcai/,B,Conference,软工
242,ICWS,International Conference on Web Services(Research Track),IEEE,http://dblp.uni-trier.de/db/conf/icws/,B,Conference,软工
243,Middleware,International Middleware Conference,ACM/IFIP/ USENIX,http://dblp.uni-trier.de/db/conf/middleware/,B,Conference,软工
244,SAS,International Static Analysis Symposium,Springer,http://dblp.uni-trier.de/db/conf/sas/,B,Conference,软工
245,ESEM,International Symposium on Empirical Software Engineering and Measurement,ACM/IEEE,http://dblp.uni-trier.de/db/conf/esem/,B,Conference,软工
246,FM,International Symposium on Formal Methods,FME,http://dblp.uni-trier.de/db/conf/fm/,B,Conference,软工
247,ISSRE,International Symposium on Software Reliability Engineering,IEEE,http://dblp.uni-trier.de/db/conf/issre/,B,Conference,软工
248,HotOS,USENIX Workshop on Hot Topics in Operating Systems,USENIX,http://dblp.uni-trier.de/db/conf/hotos/,B,Conference,软工
249,PEPM,ACM SIGPLAN Workshop on Partial Evaluation and Program Manipulation,ACM,http://dblp.uni-trier.de/db/conf/pepm/,C,Conference,软工
250,PASTE,ACMSIGPLAN-SIGSOFT Workshop on Program Analysis for Software Tools and Engineering,ACM,http://dblp.uni-trier.de/db/conf/paste/,C,Conference,软工
251,APLAS,Asian Symposium on Programming Languages and Systems,Springer,http://dblp.uni-trier.de/db/conf/aplas/,C,Conference,软工
252,APSEC,Asia-Pacific Software Engineering Conference,IEEE,http://dblp.uni-trier.de/db/conf/apsec/,C,Conference,软工
253,EASE,Evaluation and Assessment in Software Engineering,ACM,http://dblp.uni-trier.de/db/conf/ease/,C,Conference,软工
254,ICECCS,IEEE International Conference on Engineering of Complex Computer Systems,IEEE,http://dblp.uni-trier.de/db/conf/iceccs/,C,Conference,软工
255,ICST,"IEEE International Conference on Software Testing, Verification and Validation",IEEE,http://dblp.uni-trier.de/db/conf/icst/,C,Conference,软工
256,ISPASS,IEEE International Symposium on Performance Analysis of Systems and Software,IEEE,http://dblp.uni-trier.de/db/conf/ispass/,C,Conference,软工
257,SCAM,IEEE International Working Conference on Source Code Analysis and Manipulation,IEEE,http://dblp.uni-trier.de/db/conf/scam/,C,Conference,软工
258,COMPSAC,International Computer Software and Applications Conference,IEEE,http://dblp.uni-trier.de/db/conf/compsac/,C,Conference,软工
259,ICFEM,International Conference on Formal Engineering Methods,Springer,http://dblp.uni-trier.de/db/conf/icfem/,C,Conference,软工
260,TOOLS,"International Conference on Objects, Models, Components, Patterns",Springer,http://dblp.uni-trier.de/db/conf/tools/index.html、https://dblp.uni-trier.de/db/conf/staf/index.html,C,Conference,软工
261,SCC,International Conference on Service Computing,IEEE,http://dblp.uni-trier.de/db/conf/IEEEscc/,C,Conference,软工
262,ICSSP,International Conference on Software and System Process,ISPA,http://dblp.uni-trier.de/db/conf/ispw/,C,Conference,软工
263,SEKE,International Conference on Software Engineering and Knowledge Engineering,KSI,http://dblp.uni-trier.de/db/conf/seke/,C,Conference,软工
264,QRS,"International Conference on Software Quality, Reliability and Security",IEEE,http://paris.utdallas.edu/qrs/,C,Conference,软工
265,ICSR,International Conference on Software Reuse,Springer,http://dblp.uni-trier.de/db/conf/icsr/,C,Conference,软工
266,ICWE,International Conference on Web Engineering,Springer,http://dblp.uni-trier.de/db/conf/icwe/,C,Conference,软工
267,SPIN,International SPIN Workshop on Model Checking of Software,Springer,http://dblp.uni-trier.de/db/conf/spin/index.html,C,Conference,软工
268,ATVA,International Symposium on Automated Technology for Verification and Analysis,Springer,http://dblp.uni-trier.de/db/conf/atva/,C,Conference,软工
269,LOPSTR,International Symposium on Logic-based Program Synthesis and Transformation,Springer,http://dblp.uni-trier.de/db/conf/lopstr/,C,Conference,软工
270,TASE,International Symposium on Theoretical Aspects of Software Engineering,IEEE,http://dblp.uni-trier.de/db/conf/tase/,C,Conference,软工
271,MSR,Mining Software Repositories,IEEE/ACM,http://dblp.uni-trier.de/db/conf/msr/,C,Conference,软工
272,REFSQ,Requirements Engineering: Foundation for Software Quality,Springer,http://dblp.uni-trier.de/db/conf/refsq/,C,Conference,软工
273,WICSA,Working IEEE/IFIP Conference on Software Architecture,IEEE,http://dblp.uni-trier.de/db/conf/wicsa/、https://dblp.uni-trier.de/db/conf/icsa/index.html,C,Conference,软工
274,TODS,ACM Transactions on Database Systems,ACM,http://dblp.uni-trier.de/db/journals/tods/,A ,Journal,软工
275,TOIS,ACM Transactions on Information Systems,ACM,http://dblp.uni-trier.de/db/journals/tois/,A ,Journal,软工
276,TKDE,IEEE Transactions on Knowledge and Data Engineering,IEEE,http://dblp.uni-trier.de/db/journals/tkde/,A ,Journal,软工
277,VLDBJ,The VLDB Journal,Springer,http://dblp.uni-trier.de/db/journals/vldb/,A ,Journal,软工
278,TKDD,ACM Transactions on Knowledge Discovery from Data,ACM,http://dblp.uni-trier.de/db/journals/tkdd/,B,Journal,软工
279,TWEB,ACM Transactions on the Web,ACM,http://dblp.uni-trier.de/db/journals/tweb/,B,Journal,软工
280,AEI,Advanced Engineering Informatics,Elsevier,http://dblp.uni-trier.de/db/journals/aei/,B,Journal,软工
281,DKE,Data and Knowledge Engineering,Elsevier,http://dblp.uni-trier.de/db/journals/dke/,B,Journal,软工
282,DMKD,Data Mining and Knowledge Discovery,Springer,http://dblp.uni-trier.de/db/journals/datamine/,B,Journal,软工
283,EJIS,European Journal of Information Systems,The OR Society,http://dblp.uni-trier.de/db/journals/ejis/,B,Journal,软工
284,G,GeoInformatica,Springer,http://dblp.uni-trier.de/db/journals/geoinformatica/,B,Journal,软工
285,IPM,Information Processing and Management,Elsevier,http://dblp.uni-trier.de/db/journals/ipm/,B,Journal,软工
286,IS,Information Sciences,Elsevier,http://dblp.uni-trier.de/db/journals/isci/,B,Journal,软工
287,IS,Information Systems,Elsevier,http://dblp.uni-trier.de/db/journals/is/,B,Journal,数据库
288,JASIST,Journal of the American Society for Information Science and Technology,American Society for Information Science and Technology,http://dblp.uni-trier.de/db/journals/jasis/,B,Journal,数据库
289,JWS,Journal of Web Semantics,Elsevier,http://dblp.uni-trier.de/db/journals/ws/,B,Journal,数据库
290,KAIS,Knowledge and Information Systems,Springer,http://dblp.uni-trier.de/db/journals/kais/,B,Journal,数据库
291,DPD,Distributed and Parallel Databases,Springer,http://dblp.uni-trier.de/db/journals/dpd/,C,Journal,数据库
292,I&M,Information and Management,Elsevier,http://dblp.uni-trier.de/db/journals/iam/,C,Journal,数据库
293,IPL,Information Processing Letters,Elsevier,http://dblp.uni-trier.de/db/journals/ipl/,C,Journal,数据库
294,IR,Information Retrieval Journal,Springer,http://dblp.uni-trier.de/db/journals/ir/,C,Journal,数据库
295,IJCIS,International Journal of Cooperative Information Systems,World Scientific,http://dblp.uni-trier.de/db/journals/ijcis/,C,Journal,数据库
296,IJGIS,International Journal of Geographical Information Science,Taylor & Francis,http://dblp.uni-trier.de/db/journals/gis/,C,Journal,数据库
297,IJIS,International Journal of Intelligent Systems,Wiley,http://dblp.uni-trier.de/db/journals/ijis/,C,Journal,数据库
298,IJKM,International Journal of Knowledge Management,IGI,http://dblp.uni-trier.de/db/journals/ijkm/,C,Journal,数据库
299,IJSWIS,International Journal on Semantic Web and Information Systems,IGI,http://dblp.uni-trier.de/db/journals/ijswis/,C,Journal,数据库
300,JCIS,Journal of Computer Information Systems,IACIS,http://dblp.uni-trier.de/db/journals/jcis/,C,Journal,数据库
301,JDM,Journal of Database Management,IGI-Global,http://dblp.uni-trier.de/db/journals/jdm/,C,Journal,数据库
302,JGITM,Journal of Global Information Technology Management,Ivy League Publishing,http://www.tandfonline.com/loi/ugit20#.Vnv35pN97rI,C,Journal,数据库
303,JIIS,Journal of Intelligent Information Systems,Springer,http://dblp.uni-trier.de/db/journals/jiis/,C,Journal,数据库
304,JSIS,Journal of Strategic Information Systems,Elsevier,http://dblp.uni-trier.de/db/journals/jsis/,C,Journal,数据库
305,SIGMOD,ACM Conference on Management of Data,ACM,http://dblp.uni-trier.de/db/conf/sigmod/,A,Conference,数据库
306,SIGKDD,ACM Knowledge Discovery and Data Mining,ACM,http://dblp.uni-trier.de/db/conf/kdd/,A,Conference,数据库
307,ICDEIEEE,International Conference on Data Engineering,IEEE,http://dblp.uni-trier.de/db/conf/icde/,A,Conference,数据库
308,SIGIR,International Conference on Research on Development in Information Retrieval,ACM,http://dblp.uni-trier.de/db/conf/sigir/,A,Conference,数据库
309,VLDB,International Conference on Very Large Data Bases,Morgan Kaufmann,http://dblp.uni-trier.de/db/conf/vldb/,A,Conference,数据库
310,CIKM,ACM International Conference on Information and Knowledge Management,ACM,http://dblp.uni-trier.de/db/conf/cikm/,B,Conference,数据库
311,WSDM,ACM International Conference on Web Search and Data Mining,ACM,http://dblp.uni-trier.de/db/conf/wsdm/,B,Conference,数据库
312,PODS,ACM Symposium on Principles of Database Systems,ACM,http://dblp.uni-trier.de/db/conf/pods/,B,Conference,数据库
313,DASFAA,Database Systems for Advanced Applications,Springer,http://dblp.uni-trier.de/db/conf/dasfaa/,B,Conference,数据库
314,ECML-PKDD,European Conference on Machine Learning and Principles and Practice of Knowledge Discovery in Databases,Springer,http://dblp.uni-trier.de/db/conf/ecml/,B,Conference,数据库
315,ISWC,IEEEInternational Semantic Web Conference,IEEE,http://dblp.uni-trier.de/db/conf/semweb/,B,Conference,数据库
316,ICDM,International Conference on Data Mining,IEEE,http://dblp.uni-trier.de/db/conf/icdm/,B,Conference,数据库
317,ICDT,International Conference on Database Theory,Springer,http://dblp.uni-trier.de/db/conf/icdt/,B,Conference,数据库
318,EDBT,International Conference on Extending DB Technology,Springer,http://dblp.uni-trier.de/db/conf/edbt/,B,Conference,数据库
319,CIDR,International Conference on Innovative Data Systems Research,Online Proceeding,http://dblp.uni-trier.de/db/conf/cidr/,B,Conference,数据库
320,SDM,SIAM International Conference on Data Mining, SIAM,http://dblp.uni-trier.de/db/conf/sdm/,B,Conference,数据库
321,APWeb,Asia Pacific Web Conference,Springer,http://dblp.uni-trier.de/db/conf/apweb/,C,Conference,数据库
322,DEXA,Database and Expert System Applications,Springer,http://dblp.uni-trier.de/db/conf/dexa/,C,Conference,数据库
323,ECIR,European Conference on IR Research,Springer,http://dblp.uni-trier.de/db/conf/ecir/,C,Conference,数据库
324,ESWC,Extended Semantic Web Conference,Elsevier,http://dblp.uni-trier.de/db/conf/esws/,C,Conference,数据库
325,WebDB,International ACM Workshop on Web and Databases,ACM,http://dblp.uni-trier.de/db/conf/webdb/,C,Conference,数据库
326,ER,International Conference on Conceptual Modeling,Springer,http://dblp.uni-trier.de/db/conf/er/,C,Conference,数据库
327,MDM,International Conference on Mobile Data Management,IEEE,http://dblp.uni-trier.de/db/conf/mdm/,C,Conference,数据库
328,SSDBM,International Conference on Scientific and Statistical DB Management,IEEE,http://dblp.uni-trier.de/db/conf/ssdbm/,C,Conference,数据库
329,WAIM,International Conference on Web Age Information Management,Springer,http://dblp.uni-trier.de/db/conf/waim/,C,Conference,数据库
330,SSTD,International Symposium on Spatial and Temporal Databases,Springer,http://dblp.uni-trier.de/db/conf/ssd/,C,Conference,数据库
331,PAKDD,Pacific-Asia Conference on Knowledge Discovery and Data Mining,Springer,http://dblp.uni-trier.de/db/conf/pakdd/,C,Conference,数据库
332,WISE,Web Information Systems Engineering,Springer,http://dblp.uni-trier.de/db/conf/wise/,C,Conference,数据库
333,TIT,IEEE Transactions on Information Theory,IEEE,http://dblp.uni-trier.de/db/journals/tit/,A,Journal,计科理论
334,IANDC,Information and Computation,Elsevier,http://dblp.uni-trier.de/db/journals/iandc/,A,Journal,计科理论
335,SICOMP,SIAM Journal on Computing,SIAM,http://dblp.uni-trier.de/db/journals/siamcomp/,A,Journal,计科理论
336,TALG,ACM Transactions on Algorithms,ACM,http://dblp.uni-trier.de/db/journals/talg/,B,Journal,计科理论
337,TOCL,ACM Transactions on Computational Logic,ACM,http://dblp.uni-trier.de/db/journals/tocl/,B,Journal,计科理论
338,TOMS,ACM Transactions on Mathematical Software,ACM,http://dblp.uni-trier.de/db/journals/toms/,B,Journal,计科理论
339,Algorithmica,Algorithmica,Springer,http://dblp.uni-trier.de/db/journals/algorithmica/,B,Journal,计科理论
340,CC,Computational complexity,Springer,http://dblp.uni-trier.de/db/journals/cc/,B,Journal,计科理论
341,FAC,Formal Aspects of Computing,Springer,http://dblp.uni-trier.de/db/journals/fac/,B,Journal,计科理论
342,FMSD,Formal Methods in System Design,Springer,http://dblp.uni-trier.de/db/journals/fmsd/,B,Journal,计科理论
343,INFORMS,INFORMS Journal on Computing,INFORMS,http://dblp.uni-trier.de/db/journals/informs/,B,Journal,计科理论
344,JCSS,Journal of Computer and System Sciences,Elsevier,http://dblp.uni-trier.de/db/journals/jcss/,B,Journal,计科理论
345,JGO,Journal of Global Optimization,Springer,http://dblp.uni-trier.de/db/journals/jgo/,B,Journal,计科理论
346,JSC,Journal of Symbolic Computation,Elsevier,http://dblp.uni-trier.de/db/journals/jsc/,B,Journal,计科理论
347,MSCS,Mathematical Structures in Computer Science,Cambridge University Press,http://dblp.uni-trier.de/db/journals/mscs/,B,Journal,计科理论
348,TCS,Theoretical Computer Science,Elsevier,http://dblp.uni-trier.de/db/journals/tcs/,B,Journal,计科理论
349,ACTA,Acta Informatica,Springer,http://dblp.uni-trier.de/db/journals/acta/,C,Journal,计科理论
350,APAL,Annals of Pure and Applied Logic,Elsevier,http://dblp.uni-trier.de/db/journals/apal/,C,Journal,计科理论
351,DAM,Discrete Applied Mathematics,Elsevier,http://dblp.uni-trier.de/db/journals/dam/,C,Journal,计科理论
352,FUIN,Fundamenta Informaticae,IOS Press,http://dblp.uni-trier.de/db/journals/fuin/,C,Journal,计科理论
353,LISP,Higher-Order and Symbolic Computation,Springer,http://dblp.uni-trier.de/db/journals/lisp/,C,Journal,计科理论
354,IPL,Information Processing Letters,Elsevier,http://dblp.uni-trier.de/db/journals/ipl/,C,Journal,计科理论
355,JCOMPLEXITY,Journal of Complexity,Elsevier,http://dblp.uni-trier.de/db/journals/jc/,C,Journal,计科理论
356,LOGCOM,Journal of Logic and Computation,Oxford University Press,http://dblp.uni-trier.de/db/journals/logcom/,C,Journal,计科理论
357,JSL,Journal of Symbolic Logic,Association for Symbolic Logic,http://dblp.uni-trier.de/db/journals/jsyml/,C,Journal,计科理论
358,LMCS,Logical Methods in Computer Science,LMCS,http://dblp.uni-trier.de/db/journals/lmcs/,C,Journal,计科理论
359,SIDMA,SIAM Journal on Discrete Mathematics,SIAM,http://dblp.uni-trier.de/db/journals/siamdm/,C,Journal,计科理论
360,TOCS,Theory of Computing Systems,Springer,http://dblp.uni-trier.de/db/journals/mst/,C,Journal,计科理论
361,STOC,ACM Symposium on Theory of Computing,ACM,http://dblp.uni-trier.de/db/conf/stoc/,A,Conference,计科理论
362,SODA,ACM-SIAM Symposium on Discrete Algorithms,SIAM,http://dblp.uni-trier.de/db/conf/soda/,A,Conference,计科理论
363,CAV,Computer Aided Verification,Springer,http://dblp.uni-trier.de/db/conf/cav/,A,Conference,计科理论
364,FOCS,IEEE Annual Symposium on Foundations of Computer Science,IEEE,http://dblp.uni-trier.de/db/conf/focs/,A,Conference,计科理论
365,LICS,IEEE Symposium on Logic in Computer Science,IEEE,http://dblp.uni-trier.de/db/conf/lics/,A,Conference,计科理论
366,SoCG,ACM Symposium on Computational Geometry,ACM,http://dblp.uni-trier.de/db/conf/compgeom/,B,Conference,计科理论
367,ESA,European Symposium on Algorithms,Springer,http://dblp.uni-trier.de/db/conf/esa/,B,Conference,计科理论
368,CCC,IEEE Conference on Computational Complexity,IEEE,http://dblp.uni-trier.de/db/conf/coco/,B,Conference,计科理论
369,ICALP,"International Colloquium on Automata, Languages and Programming",Springer,http://dblp.uni-trier.de/db/conf/icalp/,B,Conference,计科理论
370,CADE-IJCAR,International Conference on Automated Deduction/International Joint Conference on Automated Reasoning,Springer,http://dblp.uni-trier.de/db/conf/cade/,B,Conference,计科理论
371,CONCUR,International Conference on Concurrency Theory,Springer,http://dblp.uni-trier.de/db/conf/concur/,B,Conference,计科理论
372,HSCC,International Conference on Hybrid Systems: Computation and Control,Springer and ACM,http://dblp.uni-trier.de/db/conf/hybrid/,B,Conference,计科理论
373,SAT,Theory and Applications of Satisfiability Testing,Springer,http://dblp.uni-trier.de/db/conf/sat/,B,Conference,计科理论
374,CSL,Computer Science Logic,Springer,http://dblp.uni-trier.de/db/conf/csl/,C,Conference,计科理论
375,FMCAD,Formal Method in Computer-Aided Design,ACM,http://dblp.uni-trier.de/db/conf/fmcad/,C,Conference,计科理论
376,FSTTCS,Foundations of Software Technology and Theoretical Computer Science,Indian Association for Research in Computing Science,http://dblp.uni-trier.de/db/conf/fsttcs/,C,Conference,计科理论
377,DSAA,IEEE International Conference on Data Science and Advanced Analytics,​IEEE,https://dblp.uni-trier.de/db/conf/dsaa/,C,Conference,计科理论
378,ICTAC,International Colloquium on Theoretical Aspects of Computing,Springer,http://dblp.uni-trier.de/db/conf/ictac/,C,Conference,计科理论
379,IPCO,International Conference on Integer Programming and Combinatorial Optimization,Springer,http://dblp.uni-trier.de/db/conf/ipco/,C,Conference,计科理论
380,RTA,International Conference on Rewriting Techniques and Applications,Springer,http://dblp.uni-trier.de/db/conf/rta/,C,Conference,计科理论
381,ISAAC,International Symposium on Algorithms and Computation,Springer,http://dblp.uni-trier.de/db/conf/isaac/,C,Conference,计科理论
382,MFCS,Mathematical Foundations of Computer Science,Springer,http://dblp.uni-trier.de/db/conf/mfcs/,C,Conference,计科理论
383,STACS,Symposium on Theoretical Aspects of Computer Science,Springer,http://dblp.uni-trier.de/db/conf/stacs/,C,Conference,计科理论
384,TOG,ACM Transactions on Graphics,ACM,http://dblp.uni-trier.de/db/journals/tog/,A,Journal,图形学
385,TIP,IEEE Transactions on Image Processing,IEEE,http://dblp.uni-trier.de/db/journals/tip/,A,Journal,图形学
386,TVCG,IEEE Transactions on Visualization and Computer Graphics,IEEE,http://dblp.uni-trier.de/db/journals/tvcg/,A,Journal,图形学
387,TOMCCAP,"ACM Transactions on Multimedia Computing,Communications and Application",ACM,http://dblp.uni-trier.de/db/journals/tomccap/,B,Journal,图形学
388,CAGD,Computer Aided Geometric Design,Elsevier,http://dblp.uni-trier.de/db/journals/cagd/,B,Journal,图形学
389,CGF,Computer Graphics Forum,Wiley,http://dblp.uni-trier.de/db/journals/cgf/,B,Journal,图形学
390,CAD,Computer-Aided Design,Elsevier,http://dblp.uni-trier.de/db/journals/cad/,B,Journal,图形学
391,GM,Graphical Models,Elsevier,http://dblp.uni-trier.de/db/journals/cvgip/,B,Journal,图形学
392,TCSVT,IEEE Transactions on Circuits and Systems for Video Technology,IEEE,http://dblp.uni-trier.de/db/journals/tcsv/,B,Journal,图形学
393,TMM,IEEE Transactions on Multimedia,IEEE,http://dblp.uni-trier.de/db/journals/tmm/,B,Journal,图形学
394,JASA,Journal of The Acoustical Society of America,AIP,http://scitation.aip.org/content/asa/journal/jasa,B,Journal,图形学
395,SIIMS,SIAM Journal on Imaging Sciences,SIAM,http://dblp.uni-trier.de/db/journals/siamis/,B,Journal,图形学
396,Speech Com,Speech Communication,Elsevier,http://dblp.uni-trier.de/db/journals/speech/,B,Journal,图形学
397,CGTA,Computational Geometry: Theory and Applications,Elsevier,http://dblp.uni-trier.de/db/journals/comgeo/,C,Journal,图形学
398,CAVW,Computer Animation and Virtual Worlds,Wiley,http://onlinelibrary.wiley.com/journal/10.1002/(ISSN)1546-427X,C,Journal,图形学
399,C&G,Computers & Graphics,Elsevier,http://dblp.uni-trier.de/db/journals/cg/,C,Journal,图形学
400,DCG,Discrete & Computational Geometry,Springer,http://dblp.uni-trier.de/db/journals/dcg/,C,Journal,图形学
401,SPL,IEEE Signal Processing Letters,IEEE,http://dblp.uni-trier.de/db/journals/spl/,C,Journal,图形学
